{
  "board_uuids": [
    "GPU-45b611d6-7c5d-9e48-f260-4fbe5f8ef69f"
  ],
  "build_revision": "synthetic-e2a-build-0",
  "clock_epoch_id": "boot-synthetic-e2a-0000",
  "completed_work": 3,
  "device_identity": "GPU-45b611d6-7c5d-9e48-f260-4fbe5f8ef69f",
  "energy_nj": 1600000000,
  "excluded_rails": [
    "SERVER/USB_VBUS",
    "PHONE/BATTERY"
  ],
  "execution_artifact_id": "execution.tl.slot06",
  "execution_artifact_path": "execution/tl.slot06.json",
  "execution_artifact_sha256": "a7947b6ba3d0edf9159aec67e4db7e941a5959493cd35e8d65de8987c7fd17fc",
  "included_rails": [
    "GPU-45b611d6-7c5d-9e48-f260-4fbe5f8ef69f/BOARD"
  ],
  "independent_updates": 199,
  "instrument_identity": "synthetic-meter-0",
  "instrument_kind": "SYNTHETIC",
  "instrument_label": "synthetic mechanics meter",
  "kind": "RealizedTimeline",
  "marker_end_us": 195000000,
  "marker_start_us": 175000000,
  "max_gap_us": 100000,
  "normalizer_digest": "4100d28c3b594518300d81a645eca7ddda04d43a3bd436ed801278e2b6b5142c",
  "offered_work": 3,
  "outcomes": {
    "canceled": 0,
    "met": 3,
    "rejected": 0,
    "tardy": 0
  },
  "paid_payload_sha256": "9f7f137fdd1415158491b098cb9747e84692c19e5c873ea596f281ddb442cd20",
  "policy_digest": "5f2695d6035857bf89327b912bbb04864ebfa4f478c1ae527097c6a77a91909c",
  "provenance": "SYNTHETIC",
  "raw_artifact_id": "raw.tl.slot06",
  "raw_artifact_path": "raw/tl.slot06.json",
  "raw_artifact_sha256": "02204f81eb3b10c165898748cb9c49925041afe28808d8367b54dfc6cc5224ea",
  "reason_code": "SYNTHETIC_MECHANICS_FIXTURE",
  "record_sha256": "eae08c022b3561131b3578f6bc87393bc7e622bb3e6aa84c530732cc9311d7da",
  "role": "Q_PIM_TREATMENT",
  "route_schedule_digest": "da2d3b042db1e924a6769b2db870cb939d35eb5b420a7dcbdefbbbf33fa2f62d",
  "run_nonce": "run.tl.slot06",
  "sample_count": 201,
  "schema_version": 1,
  "scope": "GPU_BOARD",
  "slo_policy_digest": "17972eecf35e4c0bf8b8238c232753dd60adc68e112c0d9b40a7813cefd4a192",
  "source_revision": "933c722f6",
  "status": "OK",
  "synchronization": "MONOTONIC_SHARED",
  "timeline_id": "tl.slot06",
  "trace_digest": "edbc9fb8c78b14b155f3f81b5fb02fd95b24f8f00a6c51001e6a593bbeb38b83",
  "uncertainty_nj": 20000000,
  "window_end_us": 195000000,
  "window_start_us": 175000000,
  "workload_digest": "d5fc40efce7c5d511d2cdc724f2e2857e21bea8dd3bab648916b81e63c86f7f8"
}
